notebook_path,phase,methodology_topic,coverage_status,notes
submission_codepack_final/notebooks/submission_final_pipeline.ipynb,Global,purpose_and_scope,added_now,Expanded with technical scope and reproducibility framing
submission_codepack_final/notebooks/submission_final_pipeline.ipynb,Global,end_to_end_data_flow,added_now,Added explicit phase flow map
submission_codepack_final/notebooks/submission_final_pipeline.ipynb,Phase1,objective_and_necessity,added_now,Clarified why baseline validity is required
submission_codepack_final/notebooks/submission_final_pipeline.ipynb,Phase1,input_output_files,already_present,Expanded and normalized wording
submission_codepack_final/notebooks/submission_final_pipeline.ipynb,Phase1,formulas_and_rank_logic,added_now,Added baseline aggregation and rank formulas
submission_codepack_final/notebooks/submission_final_pipeline.ipynb,Phase1,assumptions,added_now,Added scoring-ready and fixed-universe assumptions
submission_codepack_final/notebooks/submission_final_pipeline.ipynb,Phase1,validation_checks,added_now,Added sheet/weight/country/KPI/rank alignment checks
submission_codepack_final/notebooks/submission_final_pipeline.ipynb,Phase2,calibration_file_roles,added_now,Documented effects/lags/drift/schedule roles
submission_codepack_final/notebooks/submission_final_pipeline.ipynb,Phase2,low_base_high_and_confidence,added_now,Added uncertainty anchor rationale
submission_codepack_final/notebooks/submission_final_pipeline.ipynb,Phase2,proxy_calibration_rationale,added_now,Added proxy-based assumption note
submission_codepack_final/notebooks/submission_final_pipeline.ipynb,Phase2,validation_checks,added_now,Added required-column and key integrity checks
submission_codepack_final/notebooks/submission_final_pipeline.ipynb,Phase3,impact_mapping_objective,added_now,Clarified bridge from policy language to coefficients
submission_codepack_final/notebooks/submission_final_pipeline.ipynb,Phase3,coefficient_logic,added_now,Added effect_strength bucket mapping and adjustment logic
submission_codepack_final/notebooks/submission_final_pipeline.ipynb,Phase3,assumptions,added_now,Added structural-prior and archetype assumptions
submission_codepack_final/notebooks/submission_final_pipeline.ipynb,Phase3,validation_checks,added_now,Added duplicate and consistency checks
submission_codepack_final/notebooks/submission_final_pipeline.ipynb,Phase4,scenario_definitions,added_now,Added all five scenarios explicitly
submission_codepack_final/notebooks/submission_final_pipeline.ipynb,Phase4,horizon_definition,added_now,Added 16-quarter horizon and dates
submission_codepack_final/notebooks/submission_final_pipeline.ipynb,Phase4,transition_formulas,added_now,Added drift and policy-shift formula notes
submission_codepack_final/notebooks/submission_final_pipeline.ipynb,Phase4,monte_carlo_quantiles,added_now,Added p10/median/p90 definitions
submission_codepack_final/notebooks/submission_final_pipeline.ipynb,Phase4,median_path_rationale,added_now,Added headline-statistic rationale
submission_codepack_final/notebooks/submission_final_pipeline.ipynb,Phase4,validation_checks,added_now,Added schema/recompute/integrity checks
submission_codepack_final/notebooks/submission_final_pipeline.ipynb,Phase5,benchmark_definitions,added_now,Added peer_best and global_best definitions
submission_codepack_final/notebooks/submission_final_pipeline.ipynb,Phase5,attribution_formulas,added_now,Added baseline/post gap and reduction formulas
submission_codepack_final/notebooks/submission_final_pipeline.ipynb,Phase5,non_additivity_note,added_now,Added stand-alone scenario non-additivity interpretation
submission_codepack_final/notebooks/submission_final_pipeline.ipynb,Phase5,validation_checks,added_now,Added scenario/duplicate/benchmark alignment checks
submission_codepack_final/notebooks/submission_final_pipeline.ipynb,Phase6,dashboard_input_and_simplification,added_now,Added downstream dashboard linkage and simplification notes
submission_codepack_final/notebooks/submission_final_pipeline.ipynb,Global,limitations_and_interpretation,added_now,Added benchmark and KPI subset caveats
submission_codepack_final/notebooks/submission_final_pipeline.ipynb,Global,final_summary_and_downstream_use,already_present,Retained and aligned with expanded methodology content
submission_codepack_final/notebooks/reproduce_ai_competitiveness_baseline_original_copy.ipynb,Phase1,objective_and_necessity,added_now,Expanded notebook purpose and rationale
submission_codepack_final/notebooks/reproduce_ai_competitiveness_baseline_original_copy.ipynb,Phase1,workflow_placement,added_now,Added upstream/downstream phase bridge
submission_codepack_final/notebooks/reproduce_ai_competitiveness_baseline_original_copy.ipynb,Phase1,input_output_files,added_now,Explicitly listed baseline inputs and outputs
submission_codepack_final/notebooks/reproduce_ai_competitiveness_baseline_original_copy.ipynb,Phase1,formulas_and_rank_logic,added_now,Added KPI/sub-pillar/composite/rank formulas
submission_codepack_final/notebooks/reproduce_ai_competitiveness_baseline_original_copy.ipynb,Phase1,assumptions,added_now,Added scoring-ready and fixed-universe assumptions
submission_codepack_final/notebooks/reproduce_ai_competitiveness_baseline_original_copy.ipynb,Phase1,validation_checks,added_now,Added sheet/count/weight/cross-file check summary
submission_codepack_final/notebooks/reproduce_ai_competitiveness_baseline_original_copy.ipynb,Phase1,baseline_master_table_note,added_now,Added note that artifact is not implemented
submission_codepack_final/notebooks/reproduce_ai_competitiveness_baseline_original_copy.ipynb,Phase1,reproducibility_notes,already_present,Expanded with technical execution constraints
submission_codepack_final/notebooks/reproduce_ai_competitiveness_baseline_original_copy.ipynb,Phase1,final_summary_and_downstream_use,already_present,Enhanced downstream phase usage specificity
submission_codepack_final/notebooks/reproduce_ai_competitiveness_baseline_original_copy.ipynb,Phase2,calibration_details,not_applicable,Baseline-only notebook by design
submission_codepack_final/notebooks/reproduce_ai_competitiveness_baseline_original_copy.ipynb,Phase3_4_5,simulation_and_attribution_details,not_applicable,Handled in submission_final_pipeline notebook
